{
  "alert_policy_version": "0.1.0",
  "alerts": [
    {
      "base_rate": 0.067,
      "calibrated_probability": null,
      "calibration_status": "NOT_FITTED",
      "caveat": "Synthetic fixture; no empirical calibration or validated threshold.",
      "country": "Türkiye",
      "data_coverage": 0.82,
      "evidence_alerts": [
        "CALIBRATION_WEAK"
      ],
      "evidence_confidence": 0.705,
      "first_seen": "2024-01-31",
      "fx_regime": "MANAGED_FLOAT",
      "hazard": "FX",
      "historical_percentile": 0.876,
      "horizon": "12m",
      "key_reason": "Exchange-market pressure",
      "last_changed": "2024-01-31",
      "ood_status": "NOT_ASSESSED",
      "probability_change": 0.0108,
      "raw_estimate": 0.2412,
      "relative_risk": 3.6,
      "severity": "WATCH_UNCALIBRATED",
      "threshold_methodology": null,
      "trigger_threshold": null
    },
    {
      "base_rate": 0.084,
      "calibrated_probability": null,
      "calibration_status": "NOT_FITTED",
      "caveat": "Synthetic fixture; no empirical calibration or validated threshold.",
      "country": "Türkiye",
      "data_coverage": 0.82,
      "evidence_alerts": [
        "CALIBRATION_WEAK"
      ],
      "evidence_confidence": 0.705,
      "first_seen": "2024-01-31",
      "fx_regime": "MANAGED_FLOAT",
      "hazard": "BANK",
      "historical_percentile": 0.7,
      "horizon": "36m",
      "key_reason": "Real credit growth",
      "last_changed": "2024-01-31",
      "ood_status": "NOT_ASSESSED",
      "probability_change": 0.006,
      "raw_estimate": 0.168,
      "relative_risk": 2.0,
      "severity": "WATCH_UNCALIBRATED",
      "threshold_methodology": null,
      "trigger_threshold": null
    },
    {
      "base_rate": 0.049,
      "calibrated_probability": null,
      "calibration_status": "NOT_FITTED",
      "caveat": "Synthetic fixture; no empirical calibration or validated threshold.",
      "country": "Türkiye",
      "data_coverage": 0.82,
      "evidence_alerts": [
        "CALIBRATION_WEAK"
      ],
      "evidence_confidence": 0.705,
      "first_seen": "2024-01-31",
      "fx_regime": "MANAGED_FLOAT",
      "hazard": "SOV",
      "historical_percentile": 0.755,
      "horizon": "24m",
      "key_reason": "Foreign-currency debt burden",
      "last_changed": "2024-01-31",
      "ood_status": "NOT_ASSESSED",
      "probability_change": 0.0075,
      "raw_estimate": 0.1225,
      "relative_risk": 2.5,
      "severity": "WATCH_UNCALIBRATED",
      "threshold_methodology": null,
      "trigger_threshold": null
    },
    {
      "base_rate": 0.071,
      "calibrated_probability": null,
      "calibration_status": "NOT_FITTED",
      "caveat": "Synthetic fixture; no empirical calibration or validated threshold.",
      "country": "Türkiye",
      "data_coverage": 0.82,
      "evidence_alerts": [
        "CALIBRATION_WEAK"
      ],
      "evidence_confidence": 0.705,
      "first_seen": "2024-01-31",
      "fx_regime": "MANAGED_FLOAT",
      "hazard": "MON",
      "historical_percentile": 0.821,
      "horizon": "12m",
      "key_reason": "Inflation acceleration",
      "last_changed": "2024-01-31",
      "ood_status": "NOT_ASSESSED",
      "probability_change": 0.0093,
      "raw_estimate": 0.2201,
      "relative_risk": 3.1,
      "severity": "WATCH_UNCALIBRATED",
      "threshold_methodology": null,
      "trigger_threshold": null
    },
    {
      "base_rate": 0.052,
      "calibrated_probability": null,
      "calibration_status": "NOT_FITTED",
      "caveat": "Synthetic fixture; no empirical calibration or validated threshold.",
      "country": "Türkiye",
      "data_coverage": 0.82,
      "evidence_alerts": [
        "CALIBRATION_WEAK"
      ],
      "evidence_confidence": 0.705,
      "first_seen": "2024-01-31",
      "fx_regime": "MANAGED_FLOAT",
      "hazard": "POL",
      "historical_percentile": 0.645,
      "horizon": "12m",
      "key_reason": "Government-stability indicator",
      "last_changed": "2024-01-31",
      "ood_status": "NOT_ASSESSED",
      "probability_change": 0.0045,
      "raw_estimate": 0.078,
      "relative_risk": 1.5,
      "severity": "WATCH_UNCALIBRATED",
      "threshold_methodology": null,
      "trigger_threshold": null
    },
    {
      "base_rate": 0.008,
      "calibrated_probability": null,
      "calibration_status": "NOT_FITTED",
      "caveat": "Synthetic fixture; no empirical calibration or validated threshold.",
      "country": "Türkiye",
      "data_coverage": 0.82,
      "evidence_alerts": [
        "CALIBRATION_WEAK"
      ],
      "evidence_confidence": 0.705,
      "first_seen": "2024-01-31",
      "fx_regime": "MANAGED_FLOAT",
      "hazard": "COUP",
      "historical_percentile": 0.574,
      "horizon": "12m",
      "key_reason": "Recent unconstitutional-change history",
      "last_changed": "2024-01-31",
      "ood_status": "NOT_ASSESSED",
      "probability_change": 0.0026,
      "raw_estimate": 0.0068,
      "relative_risk": 0.85,
      "severity": "NO_ALERT",
      "threshold_methodology": null,
      "trigger_threshold": null
    },
    {
      "base_rate": 0.016,
      "calibrated_probability": null,
      "calibration_status": "NOT_FITTED",
      "caveat": "Synthetic fixture; no empirical calibration or validated threshold.",
      "country": "Türkiye",
      "data_coverage": 0.82,
      "evidence_alerts": [
        "CALIBRATION_WEAK"
      ],
      "evidence_confidence": 0.705,
      "first_seen": "2024-01-31",
      "fx_regime": "MANAGED_FLOAT",
      "hazard": "CIV",
      "historical_percentile": 0.574,
      "horizon": "12m",
      "key_reason": "Neighbor conflict exposure",
      "last_changed": "2024-01-31",
      "ood_status": "NOT_ASSESSED",
      "probability_change": 0.0026,
      "raw_estimate": 0.0136,
      "relative_risk": 0.85,
      "severity": "NO_ALERT",
      "threshold_methodology": null,
      "trigger_threshold": null
    },
    {
      "base_rate": 0.004,
      "calibrated_probability": null,
      "calibration_status": "NOT_FITTED",
      "caveat": "Synthetic fixture; no empirical calibration or validated threshold.",
      "country": "Türkiye",
      "data_coverage": 0.82,
      "evidence_alerts": [
        "CALIBRATION_WEAK"
      ],
      "evidence_confidence": 0.705,
      "first_seen": "2024-01-31",
      "fx_regime": "MANAGED_FLOAT",
      "hazard": "WAR",
      "historical_percentile": 0.574,
      "horizon": "12m",
      "key_reason": "Regional interstate tension",
      "last_changed": "2024-01-31",
      "ood_status": "NOT_ASSESSED",
      "probability_change": 0.0026,
      "raw_estimate": 0.0034,
      "relative_risk": 0.85,
      "severity": "NO_ALERT",
      "threshold_methodology": null,
      "trigger_threshold": null
    }
  ],
  "analysis": {
    "analysis_date": "2024-01-31",
    "countries_label": "Türkiye",
    "executive_summary": "In this synthetic pipeline demonstration, FX at 24m has the largest uncalibrated risk estimate (42.5%). The historical comparison, changes, and contributors are fabricated fixtures used only to exercise report semantics.",
    "generated_at": "2024-01-31T12:00:00Z",
    "history_start": "2000-01-01",
    "major_limitation": "No empirical training, held-out calibration, or validated alert threshold is attached; no value in this report is a current-country forecast.",
    "network_policy": "DISABLED_BY_USER",
    "point_in_time_status": "RECONSTRUCTED_POINT_IN_TIME",
    "report_mode": "RESEARCH_UNCALIBRATED",
    "seed_used": true,
    "web_accessed": false
  },
  "calibration": {
    "bins": [],
    "brier_score": null,
    "calibration_period": null,
    "event_count": 0,
    "intercept": null,
    "log_loss": null,
    "message": "Numerical outputs are uncalibrated research estimates, not probabilities.",
    "method": null,
    "slope": null,
    "status": "NOT_FITTED"
  },
  "calibration_version": "none",
  "contagion": {
    "common_factor_pressure": 0.37,
    "interpretation": "Network pressure is an association and is not evidence of direct contagion causation.",
    "network_pressure": 0.31,
    "own_country_pressure": 0.69,
    "peers": [
      {
        "channel": "trade",
        "country": "Synthetic peer A",
        "risk_index": 0.44
      },
      {
        "channel": "common anchor",
        "country": "Synthetic peer B",
        "risk_index": 0.36
      },
      {
        "channel": "banking claims",
        "country": "Synthetic peer C",
        "risk_index": 0.28
      }
    ],
    "status": "SYNTHETIC_FIXTURE"
  },
  "countries": [
    {
      "anchor_currency_id": "USD",
      "capital_controls": false,
      "country_id": "TR",
      "coverage": 0.82,
      "currency_id": "TRY",
      "multiple_rates": false,
      "name": "Türkiye",
      "regime": "MANAGED_FLOAT"
    }
  ],
  "data_quality": {
    "coverage": 0.82,
    "freshness": 0.79,
    "historical_depth": 0.66,
    "overall": 0.69,
    "source_authority": 0.86,
    "source_disagreement": 0.18,
    "vintage_quality": 0.45,
    "warnings": [
      "Synthetic records do not represent real source coverage.",
      "Historical values are labelled reconstructed, not true vintage.",
      "Modern option-market evidence is missing."
    ]
  },
  "forecasts": [
    {
      "analysis_date": "2024-01-31",
      "base_rate": 0.018,
      "calibrated_probability": null,
      "calibration_version": "none",
      "confidence": 0.746,
      "contrary_evidence": [
        {
          "available": true,
          "contribution": -0.18,
          "direction": "DECREASES_ESTIMATE",
          "feature": "Export momentum"
        }
      ],
      "contributors": [
        {
          "available": true,
          "contribution": 0.72,
          "direction": "INCREASES_ESTIMATE",
          "feature": "Exchange-market pressure"
        },
        {
          "available": true,
          "contribution": 0.48,
          "direction": "INCREASES_ESTIMATE",
          "feature": "Residual FX depreciation"
        },